<?xml version="1.0" encoding="UTF-8"?>
<root xmlns:xsi="http://www.w3.org/2001/XMLSchema-instance" xsi:noNamespaceSchemaLocation="file:///c:/apps/HL7/src/SS_XML_Files/DONT_TOUCH/SS_MPA.xsd">
	<TK_test_seq>
		<test_mstr>
			<test_lab_ID>DDI</test_lab_ID>
		</test_mstr>
		<people_mstr>
			<people_lastname>Lincon</people_lastname>
			<people_firstname>Abraham</people_firstname>
			<people_midname>J</people_midname>
			<people_prefname>Ab</people_prefname>
			<people_dob>
				<year>1957</year>
				<month>10</month>
				<day>21</day>
			</people_dob>
			<people_gender>M</people_gender>
			<people_ssn>218688662</people_ssn>
			<people_homephone>510-123-4567</people_homephone>
			<people_workphone>207-787-2000</people_workphone>
		</people_mstr>
		<patient_mstr>
			<patient_notes>Comments - text area</patient_notes>
		</patient_mstr>
		<addr_mstr>
			<addr_addr1>101 Main</addr_addr1>
			<addr_addr2>Apt 201</addr_addr2>
			<addr_city>WALNUT CREEK</addr_city>
			<state_iso>CA</state_iso>
			<addr_zip>94595</addr_zip>
			<country_iso>USA</country_iso>
		</addr_mstr>
		<tk_mstr>
			<TK_ID>MD-123456</TK_ID>
			<tk_lab_sample_ID>B170125-2397-1</tk_lab_sample_ID>
			<tk_test_desc>MPA</tk_test_desc>
			<SNP_ID>rs162036</SNP_ID>
			<SNP_gene>MTRR</SNP_gene>
			<SNP_variation>K350A</SNP_variation>
			<coll_begin>
				<year>2015</year>
				<month>10</month>
				<day>21</day>
			</coll_begin>
		</tk_mstr>
		<tkr_det>
			<set_id>1</set_id>
			<tkr_item>rs10380_call</tkr_item>
			<item-check>rs10380_call</item-check>
			<tkr_lab_ref>+/-</tkr_lab_ref>
			<tkr_lab_results></tkr_lab_results>
			<tkr_lab_ref>-/-</tkr_lab_ref>
		</tkr_det>
		<tkr_det>
			<set_id>2</set_id>
			<tkr_item>rs10380_call</tkr_item>
			<item-check>rs10380_call</item-check>
			<tkr_lab_ref></tkr_lab_ref>
			<tkr_lab_results>Hetero</tkr_lab_results>
			<tkr_lab_ref>-/-</tkr_lab_ref>
		</tkr_det>
		<tk_mstr>
	      <TK_ID>MD-123456</TK_ID>
	      <tk_lab_sample_ID>B170125-2397-1</tk_lab_sample_ID>
	      <tk_test_desc>MPA</tk_test_desc>
	      <SNP_ID>rs819134</SNP_ID>
	      <SNP_gene>AHC Y</SNP_gene>
	      <SNP_variation>2</SNP_variation>
	      <coll_begin>
	        <year>2017</year>
	        <month>01</month>
	        <day>17</day>
	      </coll_begin>
	    </tk_mstr>
		<tkr_det>
	      <set_id>1</set_id>
	      <tkr_item>rs819134</tkr_item>
	      <item-check>rs819134</item-check>
	      <tkr_lab_ref>-/-</tkr_lab_ref>
	    </tkr_det>
	    <tkr_det>
	      <set_id>2</set_id>
	      <tkr_item>rs819134_call</tkr_item>
	      <item-check>rs819134_call</item-check>
	      <tkr_lab_results>T</tkr_lab_results>
	    </tkr_det>
	</TK_test_seq>
</root>
